{"schema":"ask.v1","id":"RQ-ASK-20261027-7K2Q","text":"Add a --json flag to phm queue stats","repo":"ashlrai/phantom","paths":["src/cli/queue.ts","test/cli-queue.test.ts"],"tier":"mid","acceptance":["vitest test/cli-queue.test.ts green"],"budget":{"tokens_max":400000,"usd_max":5,"wall_s_max":3600},"n":2,"pools_allowed":["codex-cmp","codex-personal"],"state":"pr_open","created_ts":"2026-10-27T01:20:00-04:00","job_ids":["RQ-ASK-20261027-7K2Q-A","RQ-ASK-20261027-7K2Q-B"],"pr":1234,"pr_url":"https://github.com/ashlrai/phantom/pull/1234","refusal_reason":null}
